{
  "version": "v1",
  "slide_id": "connector-endpoint-false-positive-test",
  "language": "zh-CN",
  "audience": "CTO / technical executive",
  "canvas": {
    "preset": "wide_16_9",
    "width_in": 13.33,
    "height_in": 7.5,
    "safe_margin_in": { "top": 0.5, "right": 0.5, "bottom": 0.5, "left": 0.5 }
  },
  "layout_pattern": "architecture-map",
  "source_summary": [
    {
      "source_id": "src_1",
      "content_type": "text",
      "description": "测试：连接器端点附近的文本重叠应为 acceptable_intentional"
    },
    {
      "source_id": "src_2",
      "content_type": "text",
      "description": "连接器从 NodeA 到 NodeB，其边界框会自然覆盖 NodeA 和 NodeB 的文本"
    }
  ],
  "takeaway": "这是一个验证连接器端点容差的测试用例",
  "regions": [
    {
      "id": "region_header",
      "role": "header",
      "bounds": { "x": 0.5, "y": 0.5, "w": 12.33, "h": 0.8 },
      "capacity": { "max_items": 2 },
      "priority": 1
    },
    {
      "id": "region_main",
      "role": "primary_visual",
      "bounds": { "x": 0.5, "y": 1.5, "w": 12.33, "h": 4.5 },
      "capacity": { "max_items": 10 },
      "priority": 2
    },
    {
      "id": "region_takeaway",
      "role": "takeaway_bar",
      "bounds": { "x": 0.5, "y": 6.5, "w": 12.33, "h": 0.5 },
      "capacity": { "max_items": 1 },
      "priority": 1
    }
  ],
  "elements": [
    {
      "id": "elem_title",
      "kind": "text",
      "semantic_role": "title",
      "region_id": "region_header",
      "content": "测试：连接器端点容差",
      "layout": { "x": 0.5, "y": 0.5, "w": 5.0, "h": 0.6 },
      "style": { "font_size_pt": 22, "bold": true },
      "constraints": { "must_stay_within_region": true, "priority": "critical" },
      "source_refs": ["src_1"]
    },
    {
      "id": "elem_node_a",
      "kind": "component_node",
      "semantic_role": "system_component",
      "region_id": "region_main",
      "content": { "label": "Node A", "shape_type": "rounded_rect" },
      "layout": { "x": 1.0, "y": 2.0, "w": 2.0, "h": 1.0 },
      "style": { "font_size_pt": 11, "background_color": "#E8F0FE" },
      "constraints": { "must_stay_within_region": true, "priority": "high" },
      "source_refs": ["src_2"]
    },
    {
      "id": "elem_label_a",
      "kind": "text",
      "semantic_role": "explanation",
      "region_id": "region_main",
      "content": "A",
      "layout": { "x": 1.5, "y": 2.3, "w": 1.0, "h": 0.4 },
      "style": { "font_size_pt": 10 },
      "constraints": { "must_stay_within_region": true, "priority": "high" },
      "source_refs": ["src_2"]
    },
    {
      "id": "elem_node_b",
      "kind": "component_node",
      "semantic_role": "system_component",
      "region_id": "region_main",
      "content": { "label": "Node B", "shape_type": "rounded_rect" },
      "layout": { "x": 5.0, "y": 2.0, "w": 2.0, "h": 1.0 },
      "style": { "font_size_pt": 11, "background_color": "#E8F0FE" },
      "constraints": { "must_stay_within_region": true, "no_overlap_with": ["elem_node_a"], "priority": "high" },
      "source_refs": ["src_2"]
    },
    {
      "id": "elem_label_b",
      "kind": "text",
      "semantic_role": "explanation",
      "region_id": "region_main",
      "content": "B",
      "layout": { "x": 5.5, "y": 2.3, "w": 1.0, "h": 0.4 },
      "style": { "font_size_pt": 10 },
      "constraints": { "must_stay_within_region": true, "priority": "high" },
      "source_refs": ["src_2"]
    },
    {
      "id": "elem_conn",
      "kind": "connector",
      "semantic_role": "data_flow",
      "region_id": "region_main",
      "content": { "connector_type": "arrow", "from": "elem_node_a", "to": "elem_node_b" },
      "layout": { "x": 2.8, "y": 1.85, "w": 2.4, "h": 1.3 },
      "style": { "shape_type": "arrow" },
      "constraints": { "priority": "medium" },
      "source_refs": ["src_2"]
    },
    {
      "id": "elem_takeaway",
      "kind": "text",
      "semantic_role": "takeaway",
      "region_id": "region_takeaway",
      "content": "这是一个验证连接器端点容差的测试用例",
      "layout": { "x": 0.5, "y": 6.5, "w": 12.33, "h": 0.5 },
      "style": { "font_size_pt": 13, "bold": true, "color": "#1A73E8" },
      "constraints": { "must_stay_within_region": true, "max_lines": 1, "priority": "critical" },
      "source_refs": ["src_1"]
    }
  ],
  "constraints": {
    "min_font_pt": { "title": 18, "body": 10, "footnote": 8.5, "table_cell": 8.5 },
    "no_overlap": true
  },
  "provenance": [
    {
      "source_id": "src_1",
      "source_type": "user_input",
      "quote_or_summary": "测试：连接器端点附近的文本重叠应为 acceptable_intentional",
      "used_by_elements": ["elem_title", "elem_takeaway"]
    },
    {
      "source_id": "src_2",
      "source_type": "user_input",
      "quote_or_summary": "连接器从 NodeA 到 NodeB，其边界框会自然覆盖 NodeA 和 NodeB 的文本",
      "used_by_elements": ["elem_node_a", "elem_label_a", "elem_node_b", "elem_label_b", "elem_conn"]
    }
  ],
  "backend_hints": {
    "preferred_backend": "pptxgenjs-native"
  }
}
