{
  "version": "v1",
  "slide_id": "text-overflow-warning-test",
  "language": "zh-CN",
  "audience": "CTO / technical executive",
  "canvas": {
    "preset": "wide_16_9",
    "width_in": 13.33,
    "height_in": 7.5,
    "safe_margin_in": { "top": 0.5, "right": 0.5, "bottom": 0.5, "left": 0.5 }
  },
  "layout_pattern": "architecture-map",
  "source_summary": [
    {
      "source_id": "src_1",
      "content_type": "text",
      "description": "测试：当文本内容过长、区域高度不足时，应发出 text_may_overflow warning"
    }
  ],
  "takeaway": "这是一个验证文本高度估算检测的测试用例",
  "regions": [
    {
      "id": "region_header",
      "role": "header",
      "bounds": { "x": 0.5, "y": 0.5, "w": 12.33, "h": 0.8 },
      "capacity": { "max_items": 2 },
      "priority": 1
    },
    {
      "id": "region_main",
      "role": "primary_visual",
      "bounds": { "x": 0.5, "y": 1.5, "w": 12.33, "h": 4.5 },
      "capacity": { "max_items": 10 },
      "priority": 2
    },
    {
      "id": "region_takeaway",
      "role": "takeaway_bar",
      "bounds": { "x": 0.5, "y": 6.5, "w": 12.33, "h": 0.5 },
      "capacity": { "max_items": 1 },
      "priority": 1
    }
  ],
  "elements": [
    {
      "id": "elem_title",
      "kind": "text",
      "semantic_role": "title",
      "region_id": "region_header",
      "content": "测试：文本高度估算",
      "layout": { "x": 0.5, "y": 0.5, "w": 5.0, "h": 0.6 },
      "style": { "font_size_pt": 22, "bold": true },
      "constraints": { "must_stay_within_region": true, "priority": "critical" },
      "source_refs": ["src_1"]
    },
    {
      "id": "elem_oversized_text",
      "kind": "note",
      "semantic_role": "explanation",
      "region_id": "region_main",
      "content": "这是一段非常长的文本内容，它包含了很多文字，远远超出了给定区域的高度限制。根据文本高度估算规则，这段文字需要多行才能显示完整，而当前区域的高度只有0.2英寸，不足以容纳这么多文字。这应该会触发一个text_may_overflow的warning警告。这是一段非常长的文本内容，它包含了很多文字，远远超出了给定区域的高度限制。根据文本高度估算规则，这段文字需要多行才能显示完整，而当前区域的高度只有0.2英寸，不足以容纳这么多文字。这应该会触发一个text_may_overflow的warning警告。",
      "layout": { "x": 1.0, "y": 2.0, "w": 3.0, "h": 0.2 },
      "style": { "font_size_pt": 10 },
      "constraints": { "must_stay_within_region": true, "priority": "high" },
      "source_refs": ["src_1"]
    },
    {
      "id": "elem_takeaway",
      "kind": "text",
      "semantic_role": "takeaway",
      "region_id": "region_takeaway",
      "content": "这是一个验证文本高度估算检测的测试用例",
      "layout": { "x": 0.5, "y": 6.5, "w": 12.33, "h": 0.5 },
      "style": { "font_size_pt": 13, "bold": true, "color": "#1A73E8" },
      "constraints": { "must_stay_within_region": true, "max_lines": 1, "priority": "critical" },
      "source_refs": ["src_1"]
    }
  ],
  "constraints": {
    "min_font_pt": { "title": 18, "body": 10, "footnote": 8.5, "table_cell": 8.5 },
    "no_overlap": true
  },
  "provenance": [
    {
      "source_id": "src_1",
      "source_type": "user_input",
      "quote_or_summary": "测试：当文本内容过长、区域高度不足时，应发出 text_may_overflow warning",
      "used_by_elements": ["elem_title", "elem_oversized_text", "elem_takeaway"]
    }
  ],
  "backend_hints": {
    "preferred_backend": "pptxgenjs-native"
  }
}
